Hotel,Location,Refined_Positive,Refined_Negative,소음,가격,위치,서비스,청결,편의시설,주소
파라다이스 호텔 부산,부산,"파라다이스 정원의 귀여운 도라에몽 포토존 덕분에 사진 찍는 재미가 쏠쏠했어요! 직원분들도 친절하셔서 더 기분 좋았고, 가족여행으로 다시 오고 싶을 만큼 모든 게 완벽했습니다. 객실은 깨끗하고 정돈이 잘 되어 있었지만,","주차장이 너무 열악했어요. TV는 크기가 작고 인터넷 속도도 느렸으며, 충전기도 불편했습니다. 투숙객 할인 혜택이 있으면 더 좋을 것 같아요.",0,0.01,0.35,0.33,0.08,0.26,"부산, 해운대구 해운대해변로 296"
파크하얏트 부산,부산,"부산 파크하얏트 호텔, 첫 방문이었는데 정말 만족스러웠어요! 룸 컨디션도 깨끗하고 직원들도 친절해서 좋았고, 특히 패밀리 스위트룸은 4인 가족에게 딱 맞는 크기였습니다. 위치도 최고였어요. 객실은 정말 좋았지만,",식당이나 다른 부대시설은 기대에 못 미쳤어요. 체크인 공간이 좁아 붐빌 때는 대기 시간이 길다는 점도 아쉬웠습니다. 체크인 시간대를 고려한 사전 준비가 부족했던 것 같아요.,0.01,0,0.32,0.39,0.1,0.2,"부산, 해운대구 마린시티1로 51"
파크 하얏트 서울,서울,"서울 야경이 한눈에 펼쳐지는 멋진 씨티뷰 객실이었어요. 화려한 광고판 불빛이 신경 쓰이지 않고 오히려 서울의 활기를 느끼게 해 좋았고, 라운지 음료와 룸서비스 음식도 만족스러웠습니다. 전반적으로 즐거운 숙박이었어요.","조식당이 좁고 테이블 간 간격이 좁아 북적이는 느낌이었어요. 코엑스몰과 연결되지 않아 외부로 나가야 하는데, 여름엔 덥고 겨울엔 춥다는 점이 불편했네요.",0.02,0.01,0.37,0.41,0.15,0.17,"서울, 강남구 테헤란로 606번지"
파르나스 호텔 제주,제주,도미토리 숙박 동안 다른 사람들의 코골이 소음 없이 편안하게 쉴 수 있었어요. 체크인 전 짐도 맡겨주셔서 정말 편리했습니다. 친절한 서비스에 감사했어요! 다음에도 꼭 다시 방문할 거예요!,"숙소에 약간의 음식 냄새가 남아있었지만, 가격 대비 정말 만족스러웠어요.",0.05,0.1,0.55,0.65,0.38,0.09,"서귀포, 서귀포시 중문관광로 72번길 100"
파티오세븐 호텔,서울,"호텔 위치가 정말 좋았고, 직원들이 친절해서 기분 좋았어요. 특히 침대가 넓어서 숙면을 취할 수 있었답니다. 편안하고 즐거운 휴식을 취할 수 있었어요.","객실과 복도가 다소 좁고, 엘리베이터가 어두컴컴해서 불편했어요. 샤워 수압도 약했고, 발코니 소파는 청결 상태가 좋지 않았습니다. 프런트 데스크는 너무 정신없었어요.",-0.02,0.02,0.27,0.13,0.13,0.08,"서울, 강남구 논현로 736"
피터캣 호텔 신촌,서울,"낡은 호텔이지만 깨끗하게 관리하려는 노력이 엿보였어요. 어메니티가 부족한 다른 곳과 달리 칫솔, 치약, 생수까지 제공해서 좋았습니다.","방이 너무 좁아 답답했고, 낡고 먼지 쌓인 창문 때문에 환기도 제대로 되지 않았어요. 겨울인데 난방이 안 되고 에어컨만 있어서 밤에는 정말 추웠습니다. 이불 밖은 위험했어요!",0.03,0.05,0.34,0.26,0.05,0.09,"서울, 마포구 백범로2길 21"
프라임관광 호텔,부산,"부산 관광이 주 목적이 아니라면, 위치는 정말 편리해요.  교통도 좋고 주변 편의시설 이용도 수월해서 좋았습니다.  다른 곳으로 이동하기에도 편한 위치였어요. 침대는 두 개에 요 하나 추가했는데, 이불에 '프라임 호텔'이라고 적혀 있었고, 살짝 습한 느낌은 있었지만 깨끗했어요.","트윈룸은 세 명이 쓰기엔 다소 좁았고, 샤워기 수압이 약해서 불편했어요. 좁은 객실 크기가 아쉬웠네요.",0.05,0.01,0.24,0.16,0.11,0.08,"부산, 동구 중앙대로 399"
프린세스 호텔,서울,"압구정 중심가에 위치해 접근성이 좋았고, 가격 대비 훌륭한 시설과 편의용품을 갖춘 호텔이었어요. 특히, 조용한 방을 요청했더니 미리 준비해주셔서 감사했고, 덕분에 편안하게 쉴 수 있었답니다. 깔끔하고 정갈한 분위기까지 더해져 만족스러운 숙박이었어요.","창문 없는 방이 있다는 후기를 보고 갔는데, 역시나 답답했어요. 샤워실 배수도 잘 안 돼 불편했고, 엘리베이터에서 심한 냄새 때문에 기분이 좋지 않았습니다. 전반적으로 쾌적하지 못했어요.",0.01,0.04,0.24,0.2,0.05,0.04,"서울, 강남구 압구정로 46길 17"
풍남주택,전주,"아늑하고 필요한 시설은 모두 갖춘 작은 호텔이었어요. 호스트와 소통도 원활해서 좋았고, 넓은 방이 필요없다면 정말 추천할 만한 곳입니다! 한옥의 운치는 좋았지만, 전반적으로는 괜찮았지만,",방음이 약해 조금 시끄러웠어요. 그리고 마당의 의자 등 야외 시설 관리가 조금 아쉬웠네요. 개선되면 더 좋을 것 같아요.,0.05,0.02,0.64,0.61,0.29,0.1,"전주, 완산구 최명희 길 26-39"
퀸스 호텔 부산 서면,부산,"호텔 위치가 마음에 쏙 들었고, 사장님 두 분 모두 너무 친절하셨어요. 늦은 시간에 도착했는데도 깨끗하게 방을 정리해주셔서 감사했습니다.","2박 동안 묵으면서 이불 커버 교체와 바닥 청소를 요청했는데, 제대로 전달이 안 된 것 같아요. 바닥이 좀 지저분했거든요.",0.06,0.05,0.76,0.83,0.34,0.31,"부산, 부산진구 부전로 56"
레인보우 호텔 명동,서울,"친절한 직원분들의 안내와 깨끗한 침구 덕분에 편안하게 묵었어요. 샤워 시설도 뜨거운 물이 콸콸 잘 나와서 좋았고,  무엇보다 호텔 전체가 깨끗하게 관리되어 있었답니다. 맛있는 조식까지 완벽한 호텔 경험이었어요!","사진과 달리 객실이 너무 좁고 수납공간이 부족해서 불편했어요. 조식도 종류가 적고 먹을 공간도 협소했고, 심지어 바퀴벌레까지 봤습니다. 전반적으로 실망스러웠어요.",0,0.04,0.22,0.18,0.14,0.05,"서울, 중구 퇴계로31길 29"
라마다 앙코르 바이 윈덤 부산 해운대,부산,"바다가 보이는 멋진 객실과 편리한 식당, 바닷가까지 가까워서 정말 좋았어요. 간단한 식사도 훌륭했고, 부산에 다시 온다면 꼭 다시 묵을 거예요! 미포 오션사이드 호텔 최고! 해운대 바다가 멋진 호텔이었지만,","주변이 조금 시끄러웠어요. 해운대역까지는 걸어서 20분 정도 걸리는 점이 아쉬웠고, 욕실에 샤워커튼이 있었으면 좋겠네요.",0.03,0.04,0.55,0.53,0.24,0.2,"부산, 해운대구 구남로 9"
라마다 앙코르 바이 윈덤 부산역,부산,"부산역 코앞이라 이동이 너무 편했어요! 조식도 가격 생각하면 정말 괜찮았고, 1층에 편의점과 카페가 있어서 편리했네요. 직원들도 친절해서 기분 좋았습니다.",여름에는 루프바 운영 시간을 좀 더 늦춰주셨으면 좋겠어요. 늦게까지 즐기고 싶은데 아쉬웠어요.,0.01,0.02,0.32,0.22,0.13,0.1,"부산, 동구 중앙대로 196번길 10"
라마다 호텔 앤 스위트 서울 남대문,서울,"서울역과 가까워서 이동이 편리했고, 객실도 넓고 깨끗해서 좋았어요. 주변에 식당과 상점이 많아 편의성도 뛰어났고, 무엇보다 조식과 객실 업그레이드 서비스에 감동했습니다!","애견 동반 객실이라 침구는 방수 처리된 소재로 바꾸는 게 좋겠어요. 와이파이는 연결이 잘 안 되고 비밀번호도 복잡해서 불편했고, 속도도 중간 정도였습니다. 체크인 때 차량 등록 정보를 프론트에 알렸는데, 반영이 안 된 점도 아쉬웠어요.",-0.01,0.01,0.28,0.27,0.14,0.14,"서울, 중구 칠패로 27"
라마다 속초 호텔,속초,"프랑제리 빵 맛있었고, 베란다에서 바다가 바로 보이는 멋진 오션뷰가 최고였어요. 카페랑 애슐리도 가까워서 좋았고, 숙소도 깨끗하고 조식도 훌륭했네요. 특히 프런트 직원분들이 친절해서 기분 좋았어요. 부킹닷컴으로 30평형 객실을 예약했는데, 퀸사이즈 침대가 있는 방과 온돌방이 하나씩 있더라고요. 온돌방은 바닥이 뜨끈뜨끈해서 이불 깔고 편하게 잘 잤지만,",장애인 편의시설이 부족했던 점은 아쉬웠어요.,0,0.01,0.06,0.03,0.01,0,"속초, 대포항희망길 106"
라마다 바이 윈덤 서울 동대문,서울,라마다 동대문 호텔은 대형 체인답게 예약부터 체크아웃까지 시스템이 잘 갖춰져 편리했어요. 세 명이서 넉넉하게 지낼 수 있는 객실도 좋았고요. 무엇보다 지하철 3개 노선과 버스 정류장이 가까워서 교통이 정말 편리했어요.,로비의 낡은 소파 때문에 호텔의 첫인상이 좋지 않았어요. 잠시 예약을 후회할 정도였죠. 좀 더 쾌적한 분위기였으면 좋았을텐데 아쉬웠습니다.,0.01,0,0.35,0.27,0.14,0.13,"서울, 중구 동호로 354"
리안 호텔,서울,"역 바로 앞이라 교통이 편리하고, 주변에 술집도 많아서 좋아요. 호텔 시설도 깔끔하고 편안했고, 근처에 맛있는 커피숍까지 있어서 더 좋았습니다. 위치도 최고!",청소 요청은 하루 전에 미리 해야 한다는 점이 다소 불편했어요. 체크인 시에 미리 알려주면 더 좋을 것 같네요.,0.05,0.01,0.41,0.3,0.17,0.15,"서울, 종로구 수표로 18길 26"
로얄호텔서울,서울,명동 한가운데 위치한 호텔이라 접근성이 정말 좋았어요. 특히 무더운 날씨에도 호텔 입구부터 시원한 에어컨 바람이 솔솔 불어서 들어가기 싫을 정도였네요! 덕분에 쾌적하게 머물렀습니다. 나머지는 정말 다 좋았어요. 편안하고 만족스러운 숙박이었답니다.,"침대 베개가 좀 꺼져서 아쉬웠지만,",0.05,0.01,0.51,0.39,0.19,0.14,"서울, 중구 명동길 61"
로얄스퀘어 호텔,서울,"김포공항 근처라 이용하기 편했고, 객실도 깨끗해서 좋았어요. 직원분들도 친절하셨고, 정말 만족스러운 숙박이었네요! 다음에도 또 이용할 것 같아요. 원룸을 개조한 호텔이었지만, 불편함 없이 정말 편안하게 잘 지냈어요. 인테리어도 훌륭했고요! 강력 추천합니다.",,0.01,0.01,0.2,0.15,0.1,0.07,"서울, 강서구 공항대로 30"
로이넷호텔 서울 마포,서울,"가족여행으로 다녀온 호텔인데, 가격 대비 만족도가 높았어요. 직원분들이 친절하게 대해주셨고, 무엇보다 객실이 깨끗해서 좋았습니다.","장기 투숙객을 위한 세탁실 이용 안내가 부족했고, 청소 후에도 냄새가 남아 아쉬웠어요. 욕실 환풍기 소리가 밤에 조금 거슬렸지만, 잠 못 이룰 정도는 아니었습니다.",0.02,0.01,0.36,0.31,0.21,0.1,"서울, 마포구 마포대로 67"
SL호텔 강릉,강릉,"강릉역과 가까워서 편했고, 주변에 먹거리와 마트도 많아 좋았어요. 가격 대비 객실도 깨끗했고, 조식까지 제공되어 70대 어머니와 함께 편안하게 여행했습니다. 다른 숙소들과 비교했을 때 최고의 선택이었어요!",옆방에서 담배를 피워서 방까지 연기가 들어와 힘들었어요. 밤늦도록 개 짖는 소리 때문에 잠 못 이룬 것도 아쉽네요. 주차장 선도 좀 정리해주시면 좋겠어요.,0.02,0,0.34,0.45,0.17,0.18,"강릉, 주문진읍 주문로 59"
소유 호텔,부산,"해운대 바닷가 바로 앞, 벡스코도 가까워서 위치가 정말 좋았어요! 가격 대비 만족도 최고였고, 무료 사우나까지 이용해서 여행의 피로를 확실히 풀었네요. 강추합니다!","아침에 퇴실 준비 중 화장실에서 물이 잘 안 내려가는 걸 발견했고, 샤워커튼과 블라인드에 곰팡이가 있었어요. 화장실 문틈의 먼지도 신경 쓰였네요. 전반적으로 깨끗했지만, 욕실 청소 상태가 아쉬웠습니다.",0.01,0,0.18,0.13,0.07,0.07,"부산, 중구 대청로 126번길 23"
익선 피터캣 호스텔,서울,"가격 대비 정말 훌륭하고, 위치도 최고였어요! 강력 추천합니다.","지하 주방에는 냉장고, 싱크대, 조리도구 등이 있었지만, 관리가 너무 안 돼서 사용하기 어려웠어요. 위생 상태가 좋지 않아서 장기 숙박 중에 요리해서 먹기는 힘들었네요.",0.05,0.03,0.54,0.35,0.12,0.19,"서울, 종로구 돈화문로11나길 59"
사랑루,전주,"조용하고 편안한 분위기에서 힐링할 수 있었어요. 객실도 깨끗하고, 관광지와 가까워서 위치도 좋았습니다. 특히 토스트, 커피, 계란, 과일 등이 준비된 든든한 조식이 인상적이었어요. 하지만 다른 계절에는 아주 만족스러울 것 같습니다.","화장실과 샤워실이 다소 좁았고, 겨울철 조식 공간은 다소 춥고 협소했어요.",0.08,0.04,0.54,0.54,0.27,0.06,전북 전주시 완산구 전주천동로 58-5
사보이 호텔,서울,"도심에 위치해 접근성이 좋고, 조용해서 숙면을 취하기에 정말 좋았어요. 편안하게 쉴 수 있는 곳이었네요.",죄송합니다. 리뷰 가이드라인 위반으로 리뷰가 게시되지 않았습니다.  자세한 내용은 문의해 주세요.,0.05,0,0.34,0.22,0.16,0.1,"서울, 중구 명동 8 나길 10"
씨크루즈호텔 속초,속초,"속초 중앙시장과 가까워(도보 6~7분) 여행하기 편했고, 호수와 바다 전망이 아름다운 숙소였어요. 가격 대비 깨끗하고 조식도 맛있었으며, 아이를 위한 침대 가드 요청도 들어주셨어요. 전망 좋은 룸에서 즐거운 시간을 보냈습니다!",호텔 앞 주차장이 너무 혼잡해서 주차하기가 힘들었어요. 주차 안내를 개선하면 더 좋을 것 같아요.,0.01,0.03,0.13,0.15,0.05,0.05,"속초, 청초호반로 273"
세종 호텔 서울 명동,서울,"명동에 있는 호텔이라 위치가 정말 좋았고, 4인 가족룸은 독립된 공간이 있어서 아이들과 편하게 쉬었어요. 특히 남산뷰가 환상적이었어요! 성수기였는데도 만족스러웠습니다.","몇 년째 이어지는 해고자 시위 때문에 호텔 출입이 불편했어요. 객실 조명이 부족해서 작업하기엔 어려웠고, 옆방 코 고는 소리 때문에 잠도 제대로 못 잤네요. 작업 때문에 방을 이용하실 분들께는 추천하지 않습니다.",-0.01,0,0.31,0.2,0.08,0.08,"서울, 중구 퇴계로 145"
서귀포 칼 호텔,제주,"올레길 여행 마지막 날, 동문시장 구경과 저녁 식사를 위해 묵었던 호텔이었는데, 클래식하면서 깔끔한 인테리어가 정말 마음에 들었어요. 지인들에게도 강력 추천할 만큼 좋았습니다! 위치는 정말 좋았지만,","호텔 어메니티가 샴푸와 바디워시밖에 없어서 개인 용품을 챙겨가는 게 좋을 것 같아요. 근처 공사장 소음이 심했는데, 스벅에서 잠깐 눈 붙이고 체크아웃했네요.",0.04,0.09,0.26,0.2,0.13,0.08,"서귀포, 칠십리로 242"
성동장,대구,"대구 친구 만나러 간 김에 잠깐 묵을 저렴한 곳 찾다가 성동장을 예약했는데, 생각보다 훨씬 좋았어요. 방이랑 욕실 리모델링해서 깔끔하고 모던했고, 뜨거운 물도 잘 나왔어요. 위치도 편리했구요! 전기장판 덕분에 따뜻하게 잘 지냈어요.","다만 에어컨이 없어서 조금 아쉬웠고, 1회용품도 준비되어 있으면 더 좋겠네요.",0.02,0.02,0.34,0.22,0.22,0.12,대구 남구 성당로 38
서울 가든 호텔,서울,"공덕역과 마포역이 가까워 교통이 편리하고, 주변에 맛집이 많아 좋았어요. 특히 가성비가 정말 훌륭했어요!","건물은 다소 오래됐지만 깨끗하게 관리되어 있었고, 방도 깔끔해서 만족스러웠습니다. 호텔 주차는 타워 주차시 유료이며, 출차 시 추가 요금이 발생합니다. 지하 주차장은 무료라고 안내문에 적혀 있지만, 현장에선 안내받지 못했고, 입구 위치가 불편해 찾기 어려웠습니다. 또한, 객실이 너무 건조해서 숙면을 취하기 힘들었습니다.",0.02,0.01,0.21,0.17,0.11,0.09,"서울, 마포구 마포대로 58"
서울앤호텔 동대문,서울,"개인 커튼으로 프라이빗하게 이용할 수 있는 도미토리가 마음에 들었어요. 지하철역과 가까워서 편리했고, 가격 대비 만족스러웠습니다. 특히 조식(6600원)도 괜찮았고, 직원분들이 친절하고 외국어도 잘하시더라고요.","화장실과 샤워실이 반투명 유리라 프라이버시가 부족했고, 좁은 방 크기 때문에 더 불편했습니다. 침대 옆 세면대와 노출된 전기 코드도 위험했고, 습한 방에 에어컨 조절 장치도 없어 힘들었어요.",0,0.03,0.21,0.21,0.1,0.09,서울 종로구 종로66가길 21
서울올림픽파크텔,서울,"아산병원 진료 때문에 묵었는데, 병원이랑 가까워서 정말 편했어요. 조식도 맛있었고, 공연 후 숙소까지 가깝다는 점도 좋았습니다. 위치가 최고였어요!","욕실이 너무 좁아 샤워할 때 물이 밖으로 많이 튀어 곰팡이가 심했어요. 조식 공간도 불편했는데, 식기가 계속 밀리고 패드도 부족했어요. 전반적으로 청결도가 떨어졌습니다.",0.02,0.04,0.14,0.19,0.02,0.02,"서울, 송파구 올림픽로 448"
서울 리베라 호텔,서울,"지하철 7호선과 가까워 교통이 편리하고, 깨끗하게 관리된 쾌적한 호텔이었어요. 친절한 직원들과 넓고 전망 좋은 욕실, 훌륭한 수영장 시설까지 완벽했습니다. 버스 정류장도 바로 앞이라 더욱 편리했죠.","오래된 호텔이라 객실 인테리어는 다소 낡았지만, 나름대로 분위기가 있었어요. 하지만 난방이 잘 안 되서 추웠고, 세면대 수전이 냉온수 따로라 불편했네요. 샤워기는 일체형이었구요.",0.02,0.03,0.2,0.21,0.12,0.06,"서울, 강남구 영동대로 737"
신라스테이 부산 김해 공항 (녹산),부산,"용두산공원 바로 아래라 위치가 정말 최고였어요! 쇼핑하고 저녁 먹고 산책하기에 깡통시장, 국제시장, 자갈치시장, 남포동 먹자골목까지 다 가깝고 편했어요. 주변 관광지 접근성이 너무 좋아서 좋았습니다.","낡은 건물이라 물맛도 이상하고, 청소 상태도 좋지 않아 불쾌했어요. 주차장이 너무 좁아서 주차하기도 힘들었고, 콘센트 위치도 불편했네요. 심한 페인트 냄새 때문에 머리가 아팠고, 다시는 오고 싶지 않아요.",0.06,0.02,0.66,0.54,0.36,0.3,"부산, 강서구 명지국제7로 38"
신라스테이 강남 역삼,서울,"호텔 위치가 너무 좋았고, 직원분들이 친절해서 체크인/체크아웃도 빨리 끝났어요.  덕분에 편하게 여행 시작/마무리할 수 있었답니다. 최고!","객실 향이 너무 강해서 머리가 아프고 속이 메스꺼웠어요. 조식도 좀 단조롭고, 가격 대비 만족도는 보통이었네요. 3주 넘게 머물렀는데, 특별한 혜택은 없어서 아쉬웠습니다.",0.02,0.02,0.22,0.15,0.12,0.03,"서울, 언주로 517"
신라스테이 구로 - 구로 디지털단지역,서울,"직원들이 정말 친절하고, 요청사항에도 바로 대응해줘서 좋았어요. 깨끗하고 위치도 편리했고, 특히 12,000원에 즐길 수 있는 조식 뷔페가 가성비 최고였습니다! 토요코인인데 아침 메뉴가 매일 달라서 좋았습니다.","단체 손님이 많아 원하는 날짜에 예약하기 어렵고, 새벽에 옆방 소음이 심했어요.",0,0.02,0.28,0.31,0.17,0.13,"서울, 동작구 시흥대로 596"
신라스테이 광화문 명동,서울,"인사동이 가까워 밤늦도록 관광하기 좋았고, 근처 맛집도 많아서 편리했어요. 아침 식사도 종류가 다양하고 직원들이 친절해서 정말 만족스러웠습니다. 전반적으로 위치와 서비스 모두 최고였어요!","가족여행이라 짐이 많았는데, 호텔 지하 주차장에서 객실까지 이동하는 길을 찾느라 애먹었어요. 방까지 가는 길이 너무 복잡했어요.",0.03,-0.01,0.31,0.22,0.17,0.06,"서울, 종로구 수송동 51-8"
신라스테이 해운대 벡스코,부산,"부킹닷컴으로 예약했는데, 체크인 때 친절한 직원분(이유리님)이 고층 바다 전망의 넓은 방으로 업그레이드해주시고 미니바까지 무료로 이용하게 해주셨어요. 정말 감사했습니다!","부산 신라스테이, 위치는 좋았지만 호텔 시설이 다소 낡아서 아쉬웠어요. 특히 조식은 시간이 짧아서 매번 줄을 서서 기다려야 했네요. 다음엔 다른 곳을 이용할 것 같아요.",0,0.02,0.25,0.19,0.05,0.07,"부산, 해운대구 해운대로570번길 46"
신라스테이 마포 홍대,서울,신라스테이를 계속 이용하는 이유는 다른 비슷한 호텔들보다 음식이 훨씬 맛있기 때문이에요. 정말 맛있어서 자꾸 찾게 되네요!,급하게 예약해서인지 체크인 시간이 너무 오래 걸렸어요. 게다가 옷장 서랍에서 쓰레기까지 발견해서 기분이 많이 상했네요. 다시 찾고 싶은 호텔은 아니에요.,0.01,0.02,0.3,0.26,0.14,0.1,"서울, 마포구 마포대로 83"
신라스테이 삼성 코엑스센터,서울,"삼성역 바로 옆이라 위치가 정말 좋았고, 멋진 전망의 룸에 배정받아 더욱 만족스러웠어요. 조용하고 편안한 분위기에서 쉴 수 있었고, 호텔 시설도 깨끗해서 좋았습니다. 다시 방문하고 싶을 만큼 최고의 위치와 쾌적한 환경이었어요.",호텔 빨래방은 카드 결제가 안 돼서 현금만 사용해야 하는 불편함이 있었어요. 게다가 건조기 성능도 좋지 않았습니다.,0.01,0,0.24,0.18,0.1,0.06,"서울, 강남구 영동대로 506"
신라스테이 서초 강남역,서울,직원들이 친절해서 기분 좋았어요. 객실도 깨끗하고 욕실도 사용하기 편리하게 잘 꾸며져 있었네요. 어메니티도 좋았습니다.,"화장실에서 하수구 냄새가 심해 방을 바꿔야 했고, 방이 너무 추웠어요. 욕조와 샤워기 사용 시 물이 많이 튀었는데, 방수벽이 좀 더 넓었으면 좋았을 거 같아요. 욕조 청소도 미흡했고, 헬스장 런닝머신 상태도 확인했어야 했네요.",0.01,0.02,0.22,0.23,0.12,0.07,"서울, 서초구 효령로 427"
신라스테이 서대문 서울역,서울,"서대문역 7, 8번 출구 바로 앞이라 교통이 무척 편리했어요. 조용하고 편안한 객실에서 잘 쉬었고, 맛있는 조식까지 완벽했습니다! 정말 위치도 좋고 편안한 호텔이었네요.","주차는 타워식이라 불편했고, 별도의 주차비까지 내야 해서 아쉬웠어요. 로비에 캐리어가 많아서 이동이 조금 불편했던 점도 있네요. 손님이 많아 복잡했던 것도 감안해야 할 것 같아요.",0.02,0.03,0.38,0.29,0.14,0.12,"서울, 서대문구 미근동 163"
신라 스테이 여수 엑스포역,여수,"신라스테이는 역에서 가까워 이동이 편했고, 멋진 전망까지 더해져 정말 편안하게 쉬었어요. 맛있는 조식과 친절한 직원들 덕분에 다음에도 꼭 다시 오고 싶네요!","신라스테이 주변은 조용했지만, 주차 공간이 부족해서 늦은 시간에는 호텔 앞에 주차해야 할 수도 있었어요. 직원분들이 친절하게 안내해주셔서 불편함은 없었지만, 근처에 특색 있는 식당이 없어 아쉬웠습니다.",0.01,0.01,0.16,0.16,0.11,0.09,"여수, 수정3길 8"
신신호텔 천지연,제주,"두 번째 혼자 여행인데, 친절한 여자 직원분들 덕분에 편안하게 잘 지냈어요. 직원분들이 세 분이나 계셨는데, 정말 친근하고 따뜻하게 대해주셔서 좋았습니다.","다만 제주도 특성상 벌레가 좀 있으니, 벌레퇴치 준비는 필수입니다. 엘리베이터가 너무 적어서 늘 기다려야 하고, 흡연실이 부족해서 흡연객과 비흡연객 모두 불편을 겪고 있어요. 2년째 이용 중인데, 흡연 관련 시설 개선이 절실합니다. 좀 더 편리하게 이용할 수 있도록 개선되었으면 좋겠어요.",0.02,0.03,0.18,0.17,0.1,0.09,"서귀포, 서문로 42-1"
신신호텔 제주공항,제주,"공항과 가까워 이동이 편리하고, 호텔 내부도 깨끗하게 관리되어 좋았어요. 주변에 음식점과 편의점 등 편의시설이 잘 갖춰져 있어서 더욱 편리했네요. 시내 관광에도 좋은 위치라 강력 추천합니다!","객실은 깨끗했지만, 수도꼭지나 샤워기, 전기포트 등이 오래되어서 불편했어요. 특히 전자키가 말썽이라 좀 신경 쓰였네요. 낡은 비품 교체가 시급해 보입니다.",0,0.04,0.18,0.12,0.07,0.04,"제주, 도령로 124"
