Hotel,Location,Refined_Positive,Refined_Negative,소음,가격,위치,서비스,청결,편의시설,주소
호텔릿 서울역,서울,"서울역과 남대문 경찰서 바로 옆이라 교통이 정말 편리해요. 주변에 밥집도 많고, 비즈니스 출장에 딱 좋은 깔끔한 방 크기였습니다.","호텔 바로 근처에 늦게까지 하는 편의점이 있긴 한데, 지하도를 건너 건물 맞은편이라 불편할 수 있어요. 밤늦게 이용하기엔 조금 번거로울 것 같네요.",0.03,0.05,0.33,0.18,0.13,0.09,"서울, 중구 후암로60길 11"
하운드 호텔 부산역,부산,"부산역에서 도보 5분 거리라 위치가 좋았어요. 스탠다드 트윈으로 잘못 예약했는데 친절한 프런트 직원분이 더블룸으로 변경해주셔서 편하게 혼자 출장을 마칠 수 있었습니다. 무엇보다 아침 일찍 도착해서 짐을 맡기고, 늦은 체크아웃에도 짐 보관을 무료로 해줘서 정말 편리했어요. 옥상 수영장은 좋았지만, 다만, 샴푸, 컨디셔너, 바디워시는 고급스러운 대용량이라 만족스러웠습니다. 향도 좋고 거품도 잘 나더라고요.",주차타워 때문에 짐 옮기기가 너무 불편했어요.,0.08,0.05,0.55,0.45,0.27,0.42,"부산, 동구 중앙대로236번길 9"
황남관 한옥호텔,경주,"첨성대 바로 앞, 야경이 아름다운 동굴과 월지 산책로와 가까운 구도심에 위치해 있어요. 호텔은 아담하고 깨끗하며, 직원분들이 친절하고 정성스러운 조식까지 제공해 만족스러웠습니다. 강력 추천해요! 게스트하우스 특성을 고려하면 나쁘지 않았습니다.","좁은 방 크기는 아쉬웠지만, 잠만 자는 용도라면 괜찮았어요.",0.08,0.03,0.63,0.64,0.29,0.12,"경주, 포석로 1038"
아이진 호텔,제주,"7월 말 성수기임에도 7~8만 원대로 쾌적한 새 호텔에 묵을 수 있어 정말 좋았어요. 넓은 방과 깨끗한 침구, 시원한 냉방 시스템, 넉넉한 화장실까지 완벽했습니다. 특히 창밖으로 펼쳐지는 멋진 시내 풍경도 잊을 수 없네요.",,0.01,0.03,0.36,0.35,0.24,0.16,"제주, 신대로22길 4"
이비스 앰배서더 부산 시티 센터,부산,"부전역 바로 앞이라 교통이 정말 편리하고, 전포 카페거리도 걸어서 금방이에요. 시내에 있어서 접근성도 좋고, 객실 에어컨도 빵빵했어요. 특히 즉석 와플이 정말 맛있었네요!","조식 뷔페 가격이 좀 비싼데, 음식 퀄리티는 그만큼 좋지 않아 아쉬웠어요. 위치는 서면 중심가랑은 조금 거리가 있고요. 첫 방에서 냄새 때문에 방을 바꿔야 했어요.",0,0.01,0.26,0.2,0.12,0.07,"부산, 부산진구 중앙대로 777"
이비스 앰배서더 명동,서울,"명동 한복판에 있어 쇼핑과 식사가 정말 편했어요. 지하철역과 버스 정류장도 가까워서 접근성이 최고였고, 직원들도 친절했습니다. 위치 하나는 정말 완벽한 호텔이었어요! 객실 배정도 처음엔 잘못됐지만, 직원분들이 신속하게 처리해주시고 친절하게 대해주셔서 감사했습니다.","조식 시간(10시까지)에 9시에 갔는데, 이미 많은 음식이 동나 있었고, 채워지지 않아 아쉬웠어요.",0.04,0.01,0.43,0.32,0.12,0.11,"서울, 중구 남대문로 78"
이비스 스타일 앰배서더 서울 강남,서울,"유명 관광지와 코엑스, 지하철역이 가까워서 이동이 편리했고,  직원들이 친절해서 좋았어요. 주변에 식당도 많아서 편하게 이용할 수 있었네요.","이비스 호텔을 자주 이용하지만, 서울 강남의 높은 물가를 감안하더라도 이번 숙박은 아쉬웠어요. 조식의 시든 야채와 낡은 매트리스, 청소가 부족했던 샤워기까지 불편한 점이 많았습니다. 전반적으로 관리 상태가 좋지 않았어요.",0.02,0.05,0.33,0.31,0.09,0.13,"서울, 강남구 삼성로 431"
임피리얼 팰리스 부티크 호텔 이태원,서울,"위치도 좋고 가격 대비 훌륭했어요. 직원들이 친절해서 더 기분 좋았고, 무엇보다 깨끗해서 편안하게 쉬다 왔습니다.","목요일 밤 지하 클럽의 시끄러운 소음과 진동 때문에 잠을 설쳤어요. 창문 틈새로 찬바람이 들어와 추웠고, 콘센트가 헐거워 충전기가 자꾸 빠지는 불편함도 있었네요. 전반적으로 휴식을 취하기엔 아쉬웠습니다.",0.04,0.02,0.55,0.42,0.26,0.14,"서울, 이태원로 221"
JW 메리어트 동대문스퀘어 서울,서울,"흥인지문이 보이는 아름다운 뷰와 한양도성 산책길이 매력적이어서 이 호텔을 선택했어요. 룸 컨디션도 최고였고, 무엇보다 직원들이 정말 친절해서 기분 좋았어요. 가격 대비 만족도가 매우 높았습니다. 호텔 라운지 직원들은 정말 친절하고 능숙했지만,",로비는 다소 아쉬웠어요. 체크인 데스크 직원들의 친절함은 조금 부족했던 것 같고요. 그리고 2박 3일 동안 김치를 못 먹어서 너무 속상했네요.,0,0.01,0.31,0.38,0.09,0.2,"서울, 청계천로 279"
JW 메리어트 호텔 서울,서울,"외국에서 온 친척분 숙소로 이용했는데, 집 근처라 위치가 정말 좋았어요. 가족끼리 머물기에도 최고였고,  덕분에 모두 만족스러운 숙박이었답니다.","헬스장 이용료와 객실 어메니티가 별도였던 점이 아쉬웠고, 지하 주차장에서 호텔로 가는 길이 백화점을 경유해야 해서 불편했습니다. 화장실 배수구가 막혀있어 불편했으니 개선이 필요해 보입니다.",0.06,0.06,0.22,0.2,0.16,0.05,"서울, 서초구 신반포로 176"
제주센트럴파크레지던스,제주,"제주 시내에 위치해 늦은 시간에도 편리하게 찾아갈 수 있었고, 주변에 걸어서 10분 거리에 다양한 맛집들이 많아서 좋았어요. 술집도 가까워서 차 없이도 편하게 즐길 수 있었답니다.",호텔이 공항과 너무 가까워서 새벽에 택시 잡기가 어려울 수 있다는 점이 불편했습니다. 아침 비행기를 이용하려면 택시를 미리 예약하는 게 좋을 것 같아요.,0.01,0.01,0.27,0.2,0.11,0.11,"제주, 신대로 12길 14"
제주 게스트하우스,제주,"신라호텔 수영장은 정말 최고였어요! 직원분들도 친절해서 편안하게 쉬다 왔고요. 특히 잘 정돈된 산책로가 너무 좋았고, 전반적으로 깨끗하고 관리가 잘 되어 있어서 힐링되는 시간이었답니다.","2박 3일 동안 숙박했는데, 조식과 석식 뷔페는 큰 차이를 못 느꼈어요. 풀사이드 바 직원들은 친절하지 않았고, 테이블과 바닥 청소 상태도 좋지 않았습니다. 수영장 선베드는 향이 좀 더 산뜻했으면 좋겠어요.",0.01,0.03,0.07,0.13,0.06,0.16,"제주, 용화로10길 14"
"조선 팰리스 서울 강남, 럭셔리 컬렉션 호텔",서울,깨끗하고 편안한 객실과 친절한 직원 덕분에 즐거운 호텔 이용이었습니다. 강남 중심에 위치해 주변 편의시설 이용도 편리했어요. 특히 직원들의 친절한 서비스가 인상적이었네요.,조선팰리스 호텔 조식이 유명해서 유료로 이용하려면 7만원이라고 합니다. 가격이 상당하네요.,0,0.04,0.34,0.35,0.07,0.27,"서울, 강남구 테헤란로 231"
정담,전주,"한옥마을 중심에 위치해 접근성이 좋았고, 객실은 깨끗하고 따뜻했어요. 특히 정성 가득한 아침 식사와 친절한 배웅이 인상 깊었네요. 가족과 함께 다시 방문하고 싶을 정도로 만족스러운 숙박이었습니다. 다른 점은 전반적으로 만족스러웠습니다.","복층 구조라 아이들이 정말 좋아했지만, 이불이 다소 무겁고 방 크기가 생각보다 작아 아쉬웠어요.",0.03,0.02,0.56,0.68,0.17,0.07,"전주, 완산구 최명희길 21-4"
케이팝호텔 서울역,서울,"서울역과 공항철도역이 바로 앞이라 이동이 너무 편했어요! 객실도 아늑하고 깨끗했고, 특히 화이트톤 인테리어가 마음에 들었네요. 다음에도 꼭 다시 갈 거예요.","언덕길에 위치한 호텔 옆 건물 공사 소음과 강풍 때문에 잠 못 이룬 밤이었어요. 샤워헤드가 고장 났는데, 다음 날까지 수리되지 않았고 데스크와 연락도 되지 않았습니다. 특히 밤에는 호텔 주변 골목이 위험하게 느껴졌어요.",0.03,0.03,0.21,0.16,0.06,0.07,"서울, 중구 후암로60길 17"
케이팝 레지던스 명동 1,서울,침구가 깨끗하고 편안해서 숙면을 취할 수 있었어요. 깨끗한 침구는 정말 마음에 들었네요.,"다만, 호텔 직원의 태도는 다소 불친절했습니다.",0,0,0.5,0.31,0.12,0.1,"서울, 중구 명동10길 7-7"
카마 호텔,전주,"신시가지와 시내 어디든 편하게 갈 수 있는 최고의 위치였어요! 침대랑 욕실도 깨끗해서 정말 좋았고, 아침엔 토스트랑 커피, 컵라면까지 간단하게 챙겨 먹을 수 있었답니다.","주차 공간이 부족해서 밤에 주차하고 숙소에 머물렀는데, 욕실이 좁아서 불편했어요. 특히 욕조와 변기가 너무 작았고, 욕조가 없어도 될 정도였습니다. 욕실 청소만 좀 더 신경써주시면 좋겠어요.",0.01,0.02,0.3,0.24,0.22,0.15,"전주, 완산구 한두평2길 8-9"
케니스테이 제주 서귀포,제주,제주 올레시장이랑 맛집들 가까워서 위치가 정말 좋았어요! 가격도 착해서 가성비 최고였습니다. 다음 제주도 여행 때도 꼭 다시 갈 거예요!,"수학여행 학생들 때문인지 밤늦도록 시끄러워 잠 못 이룬 밤이었어요. 저렴한 가격에 젊은 여행객이 많아서 그런지 소음이 심했고, 생수 1인 1병 제공이라고 써 있었는데 정작 물 한 병도 없어서 실망스러웠습니다.",0,0.03,0.22,0.16,0.1,0.06,"서귀포, 동문로 42"
켄싱턴호텔 여의도,서울,"여의도에 있어 서울 어디든 편하게 다닐 수 있었고, 특히 조식이 정말 맛있었어요! 뷔페 음식도 종류가 다양하고 맛있었답니다. 1층 로비 인테리어가 예뻐서 아이와 사진 많이 찍었네요.","한강 조망은 기대에 못 미쳤고, 객실 수납공간도 부족했어요. 조식 뷔페는 음식 상태가 좋지 않아 실망스러웠고, 청결 상태에도 문제가 있었네요. 전반적으로 객실 리모델링이 필요해 보입니다.",0.02,0.02,0.17,0.18,0.06,0.06,"서울, 영등포구 국회대로76길 16"
켄싱턴리조트 설악밸리,속초,설악산 자락의 조용한 위치에 속초 중앙시장도 가까워서 최고였어요! 리조트 시설도 깨끗하고 직원분들도 친절해서 정말 편안하게 쉬었네요. 멋진 경치와 산책로까지 완벽한 휴식이었답니다.,"객실에 들어서자마자 호텔만의 특별한 향이 느껴지지 않아 아쉬웠어요. 현관 입구 바닥의 돌이 깨져 있었고, 세면대 배수도 원활하지 않았습니다. 전반적으로 관리가 조금 부족한 느낌이었네요.",-0.01,0,0.07,0.1,0.05,0.02,"속초, 토성면 신평골길 8-25"
켄싱턴호텔 설악,속초,"설악산이 바로 코앞이라 너무 좋았어요! 오래된 호텔 특유의 분위기와 추억이 떠오르는 곳이었고, 아침 식사랑 침구도 정말 만족스러웠습니다. 최고!","객실은 다소 오래되었지만, 청소 상태가 아쉬웠어요. 거미줄과 먼지, 머리카락까지 발견되어 불쾌했고, 유명인 관련 자료들이 너무 많고 낡아서 어수선한 느낌이었네요. 특히 스캔들 관련 자료들은 정리가 필요해 보였습니다.",0.01,0.02,0.37,0.31,0.07,0.14,"속초, 설악산로 998"
코오롱 씨클라우드 호텔,부산,"부산 서면역 바로 근처라 교통이 정말 편했어요. 가격 대비 위치가 최고였고,  덕분에 여행 내내 편하게 지냈습니다.","저녁 시간대에 호텔로 가는 길이 심각한 정체로 매우 힘들었어요. 주변 포장마차 때문에 차 진입도 불편했고, 직원들의 친절함은 다소 부족하게 느껴졌습니다.",0,0,0.53,0.34,0.27,0.19,"부산, 해운대구 해운대해변로 287"
코리아나 호텔,서울,"역시 위치가 최고였어요! 침대도 푹신해서 꿀잠 잤고, 식당도 가격 대비 훌륭했네요. 강추합니다!","일요일 공항버스가 호텔 앞까지 오지 못해 애를 먹었어요. 주차장에서 트렁크 열다가 기스가 났으니 주차는 조심해야 할 것 같고요. 게다가 공사 소음이 심했고, 객실 설비에도 문제가 있어서 확인 요청을 했습니다.",0.01,0.01,0.34,0.27,0.13,0.09,"서울, 중구 세종대로 135"
레스케이프 호텔,서울,"신세계백화점 본점 미디어파사드를 가까이서 볼 수 있어 좋았고, 특히 이예지 매니저님의 친절한 설명과 배려 덕분에 부모님과 5살 아이 모두 즐거운 12월을 보냈습니다. 직원분들 모두 친절했습니다.","화장실이 좀 지저분했어요. 벽에 이물질이 붙어 있었고, 샤워부스와 욕조 상태도 좋지 않았습니다. 청결도에 신경 써주시면 좋겠어요.",0.06,0.03,0.56,0.47,0.19,0.19,"서울, 중구 퇴계로 67"
L7 강남 바이 롯데,서울,"테헤란로 중심에 위치해 코엑스까지는 약간 걸어야 하지만, 선릉역이 가까워 편리해요. 조용하고 깨끗한 숙소를 찾는다면 강력 추천합니다!",아침 식사 마감 시간을 여러 번 재촉해서 기분이 상했어요. 10층 테라스에 흡연 공간이 있으면 좋겠네요.,0.05,0.01,0.44,0.38,0.25,0.19,"서울, 강남구 테헤란로 415"
L7 해운대 바이 롯데,부산,루프탑 야외 수영장은 겨울에도 따뜻한 온수로 운영되어 아이들과 함께 즐기기 좋았어요. 사우나 시설까지 갖춰져 있어서 더욱 만족스러웠습니다. 다른 호텔과 달리 온 가족이 편하게 이용할 수 있는 점이 특히 좋았네요.,,0.05,0.02,0.5,0.41,0.29,0.29,"부산, 해운대구 해운대로570번길 55"
L7 홍대 바이 롯데,서울,홍대 9번 출구 근처 머큐어앰배서더보다 L7호텔이 훨씬 더 트렌디하고 감각적이었어요. 젊은 여행객에게 딱 맞는 최고의 위치에 있는 곳이라고 생각합니다. 서울 여행 중 최고의 선택이 될 거예요!,"수영장 이용료가 패키지에 포함되지 않아 다소 부담스러웠고, 조식이 너무 간단했습니다. 조식 메뉴에 한식 선택지를 좀 더 늘리면 좋겠어요.",0.01,0.01,0.52,0.33,0.2,0.19,"서울, 마포구 양화로 141"
L7 명동 바이 롯데,서울,"명동역 9번 출구 바로 앞이라 위치가 정말 좋았어요. 명동 관광하기에도 최고였고, 특히 요청했던 고층 객실에 남산타워 뷰까지 확보되어 더욱 만족스러웠습니다.","조식 가격이 너무 비쌌고, 종류도 팬케이크밖에 없어서 5일 중 하루만 먹고 나머지는 버렸어요. 뷔페식은 아니더라도, 한식 메뉴가 하나쯤 있었으면 좋았을 텐데 아쉬웠네요. 예약 상황 확인도 좀 늦었던 것 같아요.",0.04,0.02,0.52,0.37,0.25,0.18,"서울, 중구 퇴계로 137"
라베호텔,전주,"전주 출장으로 고심 끝에 예약했는데, 주변에 맛집도 많고 조식도 훌륭해서 정말 좋았어요. 객실도 깨끗하고 관리가 잘 되어 있었고, 가격 대비 만족도가 높았습니다. 강력 추천!","모텔 밀집 지역이라 주차가 다소 불편했고, 어메니티 관리가 아쉬웠습니다. 비누 교체가 매일 이뤄지지 않았고, 사용한 수건과 빗도 바로 치워지지 않아 위생이 조금 걱정됐네요. 다소 불편했던 점들 때문에 가격 대비 만족도는 낮았습니다.",0.04,0.06,0.2,0.19,0.08,0.06,전북 전주시 완산구 한두평2길 8-5
르서울호텔,서울,"명동과 시청역에 가까워 지하철 이용이 편리하고, 주변에 편의점, 카페, 식당 등 편의시설이 풍부해 아이들과 함께 머물기에 좋았어요. 특히 북창동 먹자골목이 가까워 가족 외식하기에도 최고였고, 가성비 좋은 복층룸까지 만족스러웠습니다.","디럭스 패밀리룸은 더블침대 두 개라 성인 4명에겐 다소 좁았어요. 어두운 조명과 부족한 콘센트 때문에 불편했고, 조식은 별도 비용이었답니다.",0.02,0.01,0.54,0.44,0.25,0.13,"서울, 서울특별시 중구 남대문로 1길 56 3층"
롯데시티호텔 김포공항,서울,"김포공항 이용객에게 최고의 위치를 자랑하는 롯데호텔에서 편리하게 숙박했어요. 교통도 좋았고, 특히 조식이 정말 만족스러웠습니다. 다음 김포공항 이용 시에도 꼭 다시 방문하고 싶네요! 호텔 내에서 구매 가능합니다.",칫솔과 면도기는 따로 준비해야 해요.,0.01,0,0.19,0.14,0.07,0.06,"서울, 강서구 하늘길 38"
롯데시티 호텔 구로,서울,"호텔 근처에 식당이 많아서 식사하기 편했고, 조식도 전날 예약하면 21,000원에 저렴하게 먹을 수 있었어요. 매일 친절하게 방 청소도 해주셨어요.","공항버스가 없어 불편했고, 아침식사는 매일 같은 메뉴라 질렸어요. 한식은 메뉴를 더 다양하게 바꿔주면 좋겠네요. 숙박비가 예전보다 올라서 아쉽고, 아침 음식 보온 상태도 개선되었으면 합니다.",0.04,0.02,0.31,0.31,0.18,0.13,"서울, 구로구 디지털로 300"
롯데시티호텔 제주,제주,"롯데시티호텔에서의 모든 경험이 환상적이었어요!  특히 17층 객실의 멋진 전망과 깨끗하고 편안한 객실 관리, 그리고 조식, 수영장, 세탁실 이용까지 모두 완벽했습니다.  가격 대비 최고의 만족도를 느꼈어요.",겨울에는 야외 수영장 이용이 어려워 아쉬웠어요. 그리고 방에서 OTT 서비스를 이용할 수 있었으면 좋겠네요.,-0.01,0.03,0.02,0.03,-0.01,0.02,"제주, 도령로 83"
롯데시티호텔 마포,서울,"롯데호텔 처음 이용해봤는데, 생각보다 훨씬 좋았어요! 샤워부스와 욕조가 함께 있는 욕실이 특히 마음에 들었고, 각 층에 정수기가 있는 점도 편리했지만,","안내 표시가 더 눈에 띄었으면 좋겠어요. 로비 편의점이 점심시간에도 안 열어서 불편했고, 화장실 변기 물이 너무 약해서 휴지도 내려가지 않았어요. 엘리베이터에서 내린 후 방 찾는 것도 쉽지 않았습니다.",0.04,0.02,0.44,0.34,0.21,0.21,"서울, 마포구 마포대로 109"
롯데시티호텔 명동,서울,"청계천이 가까워서 먹거리 즐기고 구경하기에 좋았어요. 쇼핑하기에도 편리했고, 일찍 도착해서 체크인했는데 추가요금 없이 친절하게 처리해주셨어요. 게다가 객실 청소도 깨끗하게 잘 해주셨습니다.","민주화 운동 관련 시위 소음 때문에 조금 시끄러웠지만, 숙소는 전반적으로 괜찮았어요. 다만 방 크기가 조금 더 넓었으면 좋았겠다는 아쉬움이 남네요.",0.04,0.02,0.53,0.44,0.24,0.2,"서울, 중구 삼일대로 362"
라까사 호텔 서울,서울,까사미아 가구가 멋진 호텔이었어요. 주변이 시끄러운데도 방이 정말 조용해서 좋았습니다. 편안하고 고급스러운 분위기였어요.,"아이폰 충전기가 제대로 작동하지 않아 불편했고, 화장실 세면대도 고장 나서 사용하기 힘들었어요. 수리 필요해 보입니다.",0.1,0.02,0.44,0.34,0.18,0.15,"서울, 강남구 도산대로 1길 83"
라한호텔 전주,전주,"전주 한옥마을 바로 앞에 위치해서 찾기 쉬웠어요. 아기와 첫 호텔 이용이었는데, 침대 가드와 가습기는 물론 아기 침대와 욕조까지 대여 가능해서 편리했어요. 조식 뷔페는 한식과 양식 모두 맛있었어요.","전주 여행은 처음이라 크게 불편한 점은 없었지만, 4인실 예약에도 아기 욕조와 침대, 침대 가드가 부족했어요. 유모차 이용 시 정문으로만 출입해야 하는 점도 조금 불편했네요.",0,0.02,0.24,0.22,0.07,0.06,"전주, 완산구 기린대로 85"
라발스호텔,부산,"부산대교가 한눈에 펼쳐지는 환상적인 뷰와 편리한 위치 덕분에 여행 내내 만족스러웠어요. 친절한 직원들과 아늑한 객실, 그리고 바다 전망까지 완벽했습니다! 영도 초입이라 관광지 접근성도 최고였어요.","샤워부스와 화장실이 칸막이만으로 분리되어 있어 샤워 후 화장실 바닥이 젖는 불편함이 있었어요. 와이파이 및 KT 인터넷 연결 상태가 매우 좋지 않아 사용이 어려웠고, 프런트 직원들의 응대도 불친절했습니다. 전반적으로 불편한 점이 많았네요.",0.02,0.05,0.49,0.31,0.16,0.13,"부산, 영도구 봉래나루로 82"
라비타호텔,서울,"청담역 14번 출구 바로 앞이라 위치가 너무 좋았어요! 강남 한복판에 이렇게 저렴한 가격에 깨끗한 호텔이라니 놀랐어요. 특히 침대 세 개 있는 방이 있어서 가족여행에 최고였고, 세면도구, 드라이어, 심지어 샤워가운까지 다 갖춰져 있어 편리했습니다.","방이 너무 추웠어요. 난방을 틀어도 따뜻해지지 않아서 불편했습니다. 샤워호스도 고정이 안 되고 화장실 냄새도 심했는데, 청소도 제대로 안 해줘서 더 힘들었어요. 특히 바닥에 치약 자국이 남아있었던 점이 최악이었습니다.",0.01,0.01,0.18,0.15,0.03,0.12,"서울, 서울시 강남구 영동대로 712"
라이온 관광 호텔,부산,"남포동 자갈치 여행 계획 중이시라면, 호텔 주차장 이용을 추천드립니다!  타워식 주차장이라 편리하고, 직원이 직접 주차를 도와드려요.  덕분에 여행 시작부터 편안하게 즐길 수 있을 거예요.","도심에 위치해서 공사 소음과 오토바이 소음이 심했고, 특히 새벽에 시끄러웠어요. 샤워실 배수도 잘 안 되고 에어컨도 시원하지 않았습니다. 위치가 좋긴 했지만, 소음과 시설 관리 상태가 아쉬웠네요.",0.08,0.04,0.58,0.41,0.33,0.15,"부산, 부산진구 중앙대로691번가길 14-7"
로컬스티치 크리에이터 타운 서교,서울,"젊은층 취향에 맞춘 깔끔한 호텔이었고, 편의시설도 잘 갖춰져 있었어요. 특히 같은 건물 내 상점 이용이 편리했고, 공용 주방이 정말 좋았네요. 헬스장에 필라테스 기구는 물론 인바디까지 있어서 깜짝 놀랐어요! 층고가 높아 답답하지 않았지만,","사무실 개조한 듯 아늑함은 부족했어요. 침구는 조금 아쉬웠고, 욕실 어메니티(솔, 쓰레기통 등)도 부족해서 불편했네요. 조식은 가격 대비 만족도가 낮았습니다.",0.04,0.06,0.47,0.31,0.14,0.24,"서울, 마포구 월드컵북로5길 41"
롯데호텔 제주,제주,"젊고 깔끔한 감성에 공용주방, 헬스장 등 부대시설이 훌륭하고 편리했다.직원분께서 일처리도 빠르시고 친절했습니다.","롯데호텔 금연 정책에도 불구하고 층에서 흡연이 발생했지만, 호텔 측에서 신속하게 복도에 공기청정기를 설치해 불편함 없이 이용할 수 있었습니다.  덕분에 숨쉬기 편했어요. 라세느 뷔페는 가성비가 조금 아쉬웠지만, 객실 정보가 부족해서 아쉬웠어요. 호텔 시설이 다소 오래된 느낌이 들었네요.",0.02,0.03,0.31,0.34,0.13,0.29,"서귀포, 중문관광로 72번길 35"
롯데호텔 서울,서울,"수요라세느 호텔 조식이 맛있었고, 직원들이 모두 친절했습니다. 특히 일식당 직원의 세심한 배려가 인상적이었어요. 신발을 벗고 들어가는 부분까지 신경 써주는 모습이 좋았습니다.",다른 호텔들에 비해 특별히 나은 점은 없어요. 다른 곳도 고려해 보세요.,0,0.01,0.41,0.37,0.14,0.13,서울 중구 을지로 30
롯데호텔 서울 이그제큐티브 타워,서울,"하우스키핑 서비스가 정말 훌륭했어요. 침대와 침구가 너무 편해서 푹 쉬었고, 깨끗하고 좋은 냄새까지 나서 기분까지 좋았습니다. 특히 딥티크 입욕제와 목욕 소금으로 반신욕을 즐길 수 있어서 최고였어요!",아침 7시에 프린트를 해달라는 황당한 요청 때문에 5성급 호텔에 우산이 없다는 말을 들었어요. 믿을 수 없었어요. 장우산 하나 없다니요!,0.04,0.02,0.43,0.5,0.17,0.21,서울 중구 을지로 30
롯데호텔 월드,서울,포켓몬 테마로 꾸며진 숙소가 너무 귀엽고 아기자기해서 좋았어요. 4명이서 편하게 머물 수 있는 넉넉한 공간도 마음에 들었네요. 강력 추천합니다!,"부산 파라다이스호텔 레스토랑은 가격 대비 만족도가 떨어졌고, 주문 실수도 있었어요. 객실 밖 공용 공간은 냉방이 제대로 안 돼서 불편했고요. 특히 부페는 너무 정신없어서 롯데호텔의 수준이라고 보기엔 아쉬웠습니다.",0,0.03,0.31,0.27,0.14,0.14,"서울, 송파구 올림픽로 240"
